<?xml version="1.0" encoding="UTF-8"?>
<!--Sample XML file generated by XMLSpy v2006 rel. 3 sp1 (http://www.altova.com)-->
<Merchants xmlns="http://www.ten45.com/domain/crawler" xmlns:xsi="http://www.w3.org/2001/XMLSchema-instance" xsi:schemaLocation="http://www.ten45.com/domain/crawler
C:\ten45\trunk\platform\xml\src\xsd\Config.xsd">
	<Merchant Name="backcountry.com">
		<Site Url="http://www.backcountry.com" Name="BackCountry" DownloadDelay="0" ProductIDAttribute="impressionUrl">
			<!--CategoryCrawl Group="Product1" Url="/store/GER0043/c1/s6/Gerber-Presto-3.5-Serrated-Edge-Knife.html?id=kLyGKH2y"/-->			
			<!-- CategoryCrawl Group="List1" Url="/store/group/164/c100000009/s21/Mens-Sandals.html"/-->
			<!-- CategoryCrawl Group="Category1" Url="/store/site_map/c12/Womens-Clothing.html"/-->
            
            <CategoryCrawl Group="SiteMap" Url="/store/site_map.html"/>
			<ProductCrawl Group="List1"/>
            
			<Group Name="SiteMap">
				<Category ClassName="ProductCategory" Href="./@href" XPath=".//TD/@width[contains(.,'20%')]/parent::*/A/@href[contains(.,'site_map')]/parent::*" Group="Cata1">
					<Attribute XPath="./." AttributeName="displayName" DataType="string"/>
					<Attribute XPath="./@href" AttributeName="url" DataType="URL"/>
				</Category>
			</Group>
            
			<Group Name="Cata1">
				<Category ClassName="ProductCategory" Href="./@href" XPath="//FONT/@color[contains(.,'1E6EA7')]/parent::*//A" Group="Cata2">
					<Attribute XPath="./." AttributeName="displayName" DataType="string"/>
					<Attribute XPath="./@href" AttributeName="url" DataType="URL"/>
				</Category>
			</Group>
            
			<Group Name="Cata2">
				<Category ClassName="ProductCategory" XPath="//TD/@class[contains(.,'brevmed')]/parent::*">
					<Attribute XPath=".//FONT" AttributeName="displayName" DataType="string"/>
					<Attribute XPath=".//A/@href" AttributeName="url" DataType="URL"/>
				</Category>
			</Group>
            
			<Group Name="List1">
				<Link Group="Product1"  ClassName="UrlInfo"  XPath="//TD/@bgcolor[contains(.,'EEEEEE')]/parent::*/parent::*//IMG/@alt/parent::*/parent::*" Href="./@href">
				</Link>
			</Group>
            
			<Group Name="Product1">
				<Product ClassName="OnlineProduct" XPath=".">
					<Attribute XPath=".//META[@name='PRODUCT_TITLE']/@content" AttributeName="title" DataType="string"/>
                    <Attribute XPath=".//A/@href" AttributeName="rawImageUrl" DataType="URL"/>
					<Attribute XPath=".//META[@name='PRODUCT_PRICE']/@content" AttributeName="pricing.lowerSalePrice" DataType="float"/>
					<Attribute XPath=".//META[@name='PRODUCT_ORIGPRICE']/@content" AttributeName="pricing.upperSalePrice" DataType="float"/>
				</Product>
			</Group>
            
            <Group Name="Category1">
                <Category ClassName="ProductCategory" XPath=".//TD[@id='content']">
                    <Attribute XPath=".//BR/following-sibling::B" DataType="string" AttributeName="displayName"/>
                    <Category ClassName="ProductCategory" XPath=".//FONT/B">
                        <Attribute XPath="./A/@href" DataType="string" AttributeName="url"/>
                        <Attribute XPath="./A" DataType="string" AttributeName="displayName"/>
                        <Category ClassName="ProductCategory" XPath="./parent::*/parent::*/parent::*/parent::*//TD[@width='33%']">
                            <Attribute XPath="./A/@href" DataType="string" AttributeName="url"/>
                            <Attribute XPath="./A" DataType="string" AttributeName="displayName"/>
                        </Category>
                    </Category>
                </Category>
            </Group>
		</Site>
	</Merchant>
</Merchants>
