<?xml version="1.0" encoding="UTF-8"?>
<!--Sample XML file generated by XMLSpy v2006 rel. 3 sp1 (http://www.altova.com)-->
<Merchants xmlns="http://www.ten45.com/domain/crawler" xmlns:xsi="http://www.w3.org/2001/XMLSchema-instance" xsi:schemaLocation="http://www.ten45.com/domain/crawler
C:\ten45\trunk\platform\xml\src\xsd\Config.xsd">
    <Merchant Name="ChadWicks.com">
        <Site Url="http://www.chadwicks.com" DownloadDelay="0" Name="ChadWicks.com" ProductIDAttribute="impressionUrl">
            <CategoryCrawl Group="Main" Url="/"/>
            <ProductCrawl Group="String"/>
            <Group Name="Main">
                <Category Group="Cata1" Href=".//A/@href" ClassName="ProductCategory" XSLLink="" XPath="//A/@id[contains(.,'Head')]/parent::*//@href[contains(.,'depart')]/ancestor::TD">
                    <Attribute XPath=".//IMG/@alt" DataType="string" AttributeName="displayName"/>
                    <Attribute XPath=".//A/@href" DataType="URL" AttributeName="url"/>
                </Category>
            </Group>
            <Group Name="Cata1">
                <Category ClassName="ProductCategory" XPath="//A/@id[contains(.,'eftNavigat')]/parent::*" Group="CataProdct1" Href="./@href">
                    <Attribute XPath="." DataType="string" AttributeName="displayName"/>
                    <Attribute XPath="./@href" DataType="URL" AttributeName="url"/>
                </Category>
            </Group>
            <Group Name="CataProdct1">
                <Category ClassName="ProductCategory" Href="./@href" XPath="//A/@id[contains(.,'DepartmentChildren')]/..">
                    <Attribute XPath="." DataType="string" AttributeName="displayName"/>
                    <Attribute XPath="./@href" DataType="URL" AttributeName="url"/>
                </Category>
            </Group>
            <Group Name="ProductList">          
                <Link Group="Product" Href="./@href" ClassName="UrlLink" XPath="//TD//IMG[@width=125][@height=180]/parent::*"/>
            </Group>
            <Group Name="Product">
                <Product ClassName="OnlineProduct" XPath=".">
                    <Attribute XPath=".//SPAN[@id='Summary1_lblName']/B|.//SPAN[@id='Summary1_lblName']" DataType="string" AttributeName="title"/>
                    <Attribute XPath=".//SPAN[@id='Summary1_lblPrice']" DataType="Money" AttributeName="pricing.lowerSalePrice"/>
                    <Attribute XPath=".//SPAN[@class='salepricestyle']/FONT" DataType="Money" AttributeName="pricing.upperSalePrice"/>
                    <Attribute XPath=".//IMG/@id[contains(.,'MainImage')]/../@src" DataType="URL" AttributeName="imageUrl"/>
                    <Attribute XPath=".//SPAN[@id='Summary1_lblDescription']" DataType="string" AttributeName="longDescription"/>
                </Product>
            </Group>
        </Site>
    </Merchant>
</Merchants>
