<?xml version="1.0" encoding="UTF-8"?>
<!--Sample XML file generated by XMLSpy v2006 rel. 3 sp1 (http://www.altova.com)-->
<Merchants xmlns="http://www.ten45.com/domain/crawler" xmlns:xsi="http://www.w3.org/2001/XMLSchema-instance" xsi:schemaLocation="http://www.ten45.com/domain/crawler
C:\ten45\trunk\platform\xml\src\xsd\Config.xsd">
	<Merchant Name="Bare Escentuals">
		<Site DownloadDelay="0" Name="mdformulations" Url="http://www.mdformulations.com" ProductIDAttribute="impressionUrl">
			<CategoryCrawl Group="Main" Url="/jump.jsp?itemID=0&amp;itemType=HOME_PAGE"/>
			<ProductCrawl Group="Product"/>
			<Group Name="Main">
				<Category Group="Cata1" Href="./@href" XPath="//TD[@colspan='3']//TABLE//TD/A">
					<Attribute XPath="./@href" DataType="URL" AttributeName="url"/>
					<Attribute XPath="./IMG/@alt" DataType="string" AttributeName="displayName"/>
				</Category>
			</Group>
			<Group Name="Cata1">
				<Category Group="Link" Href="./@href" XPath="//TABLE[@width='252']//TR[@valign='top']//A">
					<Attribute XPath="./@href" DataType="URL" AttributeName="url"/>
					<Attribute XPath="./IMG/@alt" DataType="string" AttributeName="displayName"/>
				</Category>
			</Group>
			<Group Name="Link">
				<Link Group="Product" Href="./../@href" XPath="//TD[@width='146']//B"/>
			</Group>
			<Group Name="Product">
				<Product ClassName="OnlineProduct" XPath=".">
					<Attribute XPath=".//DIV[@class='defaultsubheader']" AttributeName="title" DataType="string"/>
					<Attribute XPath=".//DIV[@align='center']/IMG/@src" AttributeName="imageUrl" DataType="URL"/>
					<Attribute XPath=".//DIV[@class='default']" AttributeName="description" DataType="string"/>
					<!--Attribute XPath=".//SPAN[@class='tableitem']" AttributeName="mft" DataType="int"/-->
					<Attribute XPath=".//DIV[@class='messageWasPrice']" AttributeName="pricing.upperSalePrice" DataType="Money"/>
				</Product>
			</Group>
		</Site>
	</Merchant>
</Merchants>
